agreement	disagreement	correct_verb	incorrect_verb	subject_index	verb_index	number1	completed
De groepen jongens achter Sue zien	De groepen jongens achter Sue ziet	zien	ziet	1	5	plural	De groepen jongens achter Sue zien de persoon.
De aantallen mannen bij Bill groeten	De aantallen mannen bij Bill groet	groeten	groet	1	5	plural	De aantallen mannen bij Bill groeten de persoon.
De groepen jongens bij John horen	De groepen jongens bij John hoort	horen	hoort	1	5	plural	De groepen jongens bij John horen de persoon.
De aantallen vrienden achter Mike begrijpen	De aantallen vrienden achter Mike begrijpt	begrijpen	begrijpt	1	5	plural	De aantallen vrienden achter Mike begrijpen de persoon.
De paren moeders achter John horen	De paren moeders achter John hoort	horen	hoort	1	5	plural	De paren moeders achter John horen de persoon.
De paren jongens naast Bill zien	De paren jongens naast Bill ziet	zien	ziet	1	5	plural	De paren jongens naast Bill zien de persoon.
De groepen timmermannen achter Linda vertrouwen	De groepen timmermannen achter Linda vertrouwt	vertrouwen	vertrouwt	1	5	plural	De groepen timmermannen achter Linda vertrouwen de persoon.
De paren timmermannen bij Mary missen	De paren timmermannen bij Mary mist	missen	mist	1	5	plural	De paren timmermannen bij Mary missen de persoon.
De hoeveelheden zangers bij Pat vertrouwen	De hoeveelheden zangers bij Pat vertrouwt	vertrouwen	vertrouwt	1	5	plural	De hoeveelheden zangers bij Pat vertrouwen de persoon.
De paren zangers bij Bill herkennen	De paren zangers bij Bill herkent	herkennen	herkent	1	5	plural	De paren zangers bij Bill herkennen de persoon.
De groepen zangers bij Linda stimuleren	De groepen zangers bij Linda stimuleert	stimuleren	stimuleert	1	5	plural	De groepen zangers bij Linda stimuleren de persoon.
De paren moeders naast Jim begrijpen	De paren moeders naast Jim begrijpt	begrijpen	begrijpt	1	5	plural	De paren moeders naast Jim begrijpen de persoon.
De paren vaders achter Linda zien	De paren vaders achter Linda ziet	zien	ziet	1	5	plural	De paren vaders achter Linda zien de persoon.
De stellen leraren onder Bill vertrouwen	De stellen leraren onder Bill vertrouwt	vertrouwen	vertrouwt	1	5	plural	De stellen leraren onder Bill vertrouwen de persoon.
De hoeveelheden meiden op Sue horen	De hoeveelheden meiden op Sue hoort	horen	hoort	1	5	plural	De hoeveelheden meiden op Sue horen de persoon.
De hoeveelheden leraren onder Barbara missen	De hoeveelheden leraren onder Barbara mist	missen	mist	1	5	plural	De hoeveelheden leraren onder Barbara missen de persoon.
De stellen timmermannen achter Mary onderzoeken	De stellen timmermannen achter Mary onderzoekt	onderzoeken	onderzoekt	1	5	plural	De stellen timmermannen achter Mary onderzoeken de persoon.
De aantallen dichters op Barbara stimuleren	De aantallen dichters op Barbara stimuleert	stimuleren	stimuleert	1	5	plural	De aantallen dichters op Barbara stimuleren de persoon.
De groepen tantes bij Mike zien	De groepen tantes bij Mike ziet	zien	ziet	1	5	plural	De groepen tantes bij Mike zien de persoon.
De hoeveelheden vrienden op Linda stimuleren	De hoeveelheden vrienden op Linda stimuleert	stimuleren	stimuleert	1	5	plural	De hoeveelheden vrienden op Linda stimuleren de persoon.
De aantallen tantes op Mary bekritiseren	De aantallen tantes op Mary bekritiseert	bekritiseren	bekritiseert	1	5	plural	De aantallen tantes op Mary bekritiseren de persoon.
De aantallen vaders naast Jim horen	De aantallen vaders naast Jim hoort	horen	hoort	1	5	plural	De aantallen vaders naast Jim horen de persoon.
De aantallen ooms op Linda stimuleren	De aantallen ooms op Linda stimuleert	stimuleren	stimuleert	1	5	plural	De aantallen ooms op Linda stimuleren de persoon.
De stellen leraren achter Mike bekritiseren	De stellen leraren achter Mike bekritiseert	bekritiseren	bekritiseert	1	5	plural	De stellen leraren achter Mike bekritiseren de persoon.
De paren timmermannen op Barbara vertrouwen	De paren timmermannen op Barbara vertrouwt	vertrouwen	vertrouwt	1	5	plural	De paren timmermannen op Barbara vertrouwen de persoon.
De paren jongens achter John begrijpen	De paren jongens achter John begrijpt	begrijpen	begrijpt	1	5	plural	De paren jongens achter John begrijpen de persoon.
De paren leraren naast Linda herkennen	De paren leraren naast Linda herkent	herkennen	herkent	1	5	plural	De paren leraren naast Linda herkennen de persoon.
De groepen dichters achter Barbara bekritiseren	De groepen dichters achter Barbara bekritiseert	bekritiseren	bekritiseert	1	5	plural	De groepen dichters achter Barbara bekritiseren de persoon.
De hoeveelheden zangers bij John bekritiseren	De hoeveelheden zangers bij John bekritiseert	bekritiseren	bekritiseert	1	5	plural	De hoeveelheden zangers bij John bekritiseren de persoon.
De paren vaders naast Bill vertrouwen	De paren vaders naast Bill vertrouwt	vertrouwen	vertrouwt	1	5	plural	De paren vaders naast Bill vertrouwen de persoon.
De aantallen dichters op Jim bekritiseren	De aantallen dichters op Jim bekritiseert	bekritiseren	bekritiseert	1	5	plural	De aantallen dichters op Jim bekritiseren de persoon.
De aantallen leraren bij Linda zien	De aantallen leraren bij Linda ziet	zien	ziet	1	5	plural	De aantallen leraren bij Linda zien de persoon.
De paren advocaten achter Mike horen	De paren advocaten achter Mike hoort	horen	hoort	1	5	plural	De paren advocaten achter Mike horen de persoon.
De paren doktoren op Barbara begrijpen	De paren doktoren op Barbara begrijpt	begrijpen	begrijpt	1	5	plural	De paren doktoren op Barbara begrijpen de persoon.
De paren jongens bij Jim begrijpen	De paren jongens bij Jim begrijpt	begrijpen	begrijpt	1	5	plural	De paren jongens bij Jim begrijpen de persoon.
De groepen timmermannen naast Mike missen	De groepen timmermannen naast Mike mist	missen	mist	1	5	plural	De groepen timmermannen naast Mike missen de persoon.
De stellen tantes onder Linda begrijpen	De stellen tantes onder Linda begrijpt	begrijpen	begrijpt	1	5	plural	De stellen tantes onder Linda begrijpen de persoon.
De hoeveelheden leraren op Mary begrijpen	De hoeveelheden leraren op Mary begrijpt	begrijpen	begrijpt	1	5	plural	De hoeveelheden leraren op Mary begrijpen de persoon.
De aantallen vrouwen bij Linda groeten	De aantallen vrouwen bij Linda groet	groeten	groet	1	5	plural	De aantallen vrouwen bij Linda groeten de persoon.
De hoeveelheden vaders naast Sue vertrouwen	De hoeveelheden vaders naast Sue vertrouwt	vertrouwen	vertrouwt	1	5	plural	De hoeveelheden vaders naast Sue vertrouwen de persoon.
De stellen tantes naast Bob stimuleren	De stellen tantes naast Bob stimuleert	stimuleren	stimuleert	1	5	plural	De stellen tantes naast Bob stimuleren de persoon.
De groepen boeren achter John zien	De groepen boeren achter John ziet	zien	ziet	1	5	plural	De groepen boeren achter John zien de persoon.
De stellen vrienden op Linda vertrouwen	De stellen vrienden op Linda vertrouwt	vertrouwen	vertrouwt	1	5	plural	De stellen vrienden op Linda vertrouwen de persoon.
De paren moeders op Mike begrijpen	De paren moeders op Mike begrijpt	begrijpen	begrijpt	1	5	plural	De paren moeders op Mike begrijpen de persoon.
De groepen boeren op Mike onderzoeken	De groepen boeren op Mike onderzoekt	onderzoeken	onderzoekt	1	5	plural	De groepen boeren op Mike onderzoeken de persoon.
De stellen jongens naast Jim herkennen	De stellen jongens naast Jim herkent	herkennen	herkent	1	5	plural	De stellen jongens naast Jim herkennen de persoon.
De hoeveelheden dichters onder Sue missen	De hoeveelheden dichters onder Sue mist	missen	mist	1	5	plural	De hoeveelheden dichters onder Sue missen de persoon.
De stellen vrienden op John begrijpen	De stellen vrienden op John begrijpt	begrijpen	begrijpt	1	5	plural	De stellen vrienden op John begrijpen de persoon.
De hoeveelheden timmermannen achter Pat onderzoeken	De hoeveelheden timmermannen achter Pat onderzoekt	onderzoeken	onderzoekt	1	5	plural	De hoeveelheden timmermannen achter Pat onderzoeken de persoon.
De stellen boeren bij Linda vertrouwen	De stellen boeren bij Linda vertrouwt	vertrouwen	vertrouwt	1	5	plural	De stellen boeren bij Linda vertrouwen de persoon.
De groepen zangers op Linda begrijpen	De groepen zangers op Linda begrijpt	begrijpen	begrijpt	1	5	plural	De groepen zangers op Linda begrijpen de persoon.
De stellen vrienden onder Pat horen	De stellen vrienden onder Pat hoort	horen	hoort	1	5	plural	De stellen vrienden onder Pat horen de persoon.
De paren vrouwen naast Barbara horen	De paren vrouwen naast Barbara hoort	horen	hoort	1	5	plural	De paren vrouwen naast Barbara horen de persoon.
De hoeveelheden timmermannen naast Bob stimuleren	De hoeveelheden timmermannen naast Bob stimuleert	stimuleren	stimuleert	1	5	plural	De hoeveelheden timmermannen naast Bob stimuleren de persoon.
De hoeveelheden vrienden naast Linda bekritiseren	De hoeveelheden vrienden naast Linda bekritiseert	bekritiseren	bekritiseert	1	5	plural	De hoeveelheden vrienden naast Linda bekritiseren de persoon.
De paren timmermannen onder John vertrouwen	De paren timmermannen onder John vertrouwt	vertrouwen	vertrouwt	1	5	plural	De paren timmermannen onder John vertrouwen de persoon.
De aantallen dichters bij Bill begrijpen	De aantallen dichters bij Bill begrijpt	begrijpen	begrijpt	1	5	plural	De aantallen dichters bij Bill begrijpen de persoon.
De paren meiden onder Mike missen	De paren meiden onder Mike mist	missen	mist	1	5	plural	De paren meiden onder Mike missen de persoon.
De paren zangers bij John bekritiseren	De paren zangers bij John bekritiseert	bekritiseren	bekritiseert	1	5	plural	De paren zangers bij John bekritiseren de persoon.
De paren ooms onder Bill herkennen	De paren ooms onder Bill herkent	herkennen	herkent	1	5	plural	De paren ooms onder Bill herkennen de persoon.
De paren jongens op Mary herkennen	De paren jongens op Mary herkent	herkennen	herkent	1	5	plural	De paren jongens op Mary herkennen de persoon.
De aantallen boeren bij Mary herkennen	De aantallen boeren bij Mary herkent	herkennen	herkent	1	5	plural	De aantallen boeren bij Mary herkennen de persoon.
De aantallen tantes naast Bill herkennen	De aantallen tantes naast Bill herkent	herkennen	herkent	1	5	plural	De aantallen tantes naast Bill herkennen de persoon.
De stellen vaders op Jim missen	De stellen vaders op Jim mist	missen	mist	1	5	plural	De stellen vaders op Jim missen de persoon.
De stellen tantes achter Bob stimuleren	De stellen tantes achter Bob stimuleert	stimuleren	stimuleert	1	5	plural	De stellen tantes achter Bob stimuleren de persoon.
De aantallen jongens op Mike begrijpen	De aantallen jongens op Mike begrijpt	begrijpen	begrijpt	1	5	plural	De aantallen jongens op Mike begrijpen de persoon.
De stellen ooms bij Pat vertrouwen	De stellen ooms bij Pat vertrouwt	vertrouwen	vertrouwt	1	5	plural	De stellen ooms bij Pat vertrouwen de persoon.
De hoeveelheden doktoren naast Linda onderzoeken	De hoeveelheden doktoren naast Linda onderzoekt	onderzoeken	onderzoekt	1	5	plural	De hoeveelheden doktoren naast Linda onderzoeken de persoon.
De paren vrouwen naast Linda stimuleren	De paren vrouwen naast Linda stimuleert	stimuleren	stimuleert	1	5	plural	De paren vrouwen naast Linda stimuleren de persoon.
De hoeveelheden vrouwen bij Barbara onderzoeken	De hoeveelheden vrouwen bij Barbara onderzoekt	onderzoeken	onderzoekt	1	5	plural	De hoeveelheden vrouwen bij Barbara onderzoeken de persoon.
De stellen vrienden naast Pat onderzoeken	De stellen vrienden naast Pat onderzoekt	onderzoeken	onderzoekt	1	5	plural	De stellen vrienden naast Pat onderzoeken de persoon.
De aantallen boeren achter Barbara onderzoeken	De aantallen boeren achter Barbara onderzoekt	onderzoeken	onderzoekt	1	5	plural	De aantallen boeren achter Barbara onderzoeken de persoon.
De hoeveelheden doktoren achter Bill bekritiseren	De hoeveelheden doktoren achter Bill bekritiseert	bekritiseren	bekritiseert	1	5	plural	De hoeveelheden doktoren achter Bill bekritiseren de persoon.
De groepen advocaten op Barbara horen	De groepen advocaten op Barbara hoort	horen	hoort	1	5	plural	De groepen advocaten op Barbara horen de persoon.
De paren tantes achter John zien	De paren tantes achter John ziet	zien	ziet	1	5	plural	De paren tantes achter John zien de persoon.
De hoeveelheden meiden onder Barbara groeten	De hoeveelheden meiden onder Barbara groet	groeten	groet	1	5	plural	De hoeveelheden meiden onder Barbara groeten de persoon.
De aantallen leraren achter Barbara stimuleren	De aantallen leraren achter Barbara stimuleert	stimuleren	stimuleert	1	5	plural	De aantallen leraren achter Barbara stimuleren de persoon.
De stellen boeren op Pat herkennen	De stellen boeren op Pat herkent	herkennen	herkent	1	5	plural	De stellen boeren op Pat herkennen de persoon.
De paren ooms onder Pat groeten	De paren ooms onder Pat groet	groeten	groet	1	5	plural	De paren ooms onder Pat groeten de persoon.
De groepen advocaten naast Bill vertrouwen	De groepen advocaten naast Bill vertrouwt	vertrouwen	vertrouwt	1	5	plural	De groepen advocaten naast Bill vertrouwen de persoon.
De paren doktoren naast Linda stimuleren	De paren doktoren naast Linda stimuleert	stimuleren	stimuleert	1	5	plural	De paren doktoren naast Linda stimuleren de persoon.
De groepen leraren achter Mike herkennen	De groepen leraren achter Mike herkent	herkennen	herkent	1	5	plural	De groepen leraren achter Mike herkennen de persoon.
De aantallen mannen onder Barbara zien	De aantallen mannen onder Barbara ziet	zien	ziet	1	5	plural	De aantallen mannen onder Barbara zien de persoon.
De stellen boeren naast Bob groeten	De stellen boeren naast Bob groet	groeten	groet	1	5	plural	De stellen boeren naast Bob groeten de persoon.
De groepen tantes naast Linda zien	De groepen tantes naast Linda ziet	zien	ziet	1	5	plural	De groepen tantes naast Linda zien de persoon.
De hoeveelheden moeders op Pat missen	De hoeveelheden moeders op Pat mist	missen	mist	1	5	plural	De hoeveelheden moeders op Pat missen de persoon.
De hoeveelheden vaders bij Barbara herkennen	De hoeveelheden vaders bij Barbara herkent	herkennen	herkent	1	5	plural	De hoeveelheden vaders bij Barbara herkennen de persoon.
De groepen leraren op Linda vertrouwen	De groepen leraren op Linda vertrouwt	vertrouwen	vertrouwt	1	5	plural	De groepen leraren op Linda vertrouwen de persoon.
De stellen ooms achter Jim groeten	De stellen ooms achter Jim groet	groeten	groet	1	5	plural	De stellen ooms achter Jim groeten de persoon.
De groepen doktoren op John zien	De groepen doktoren op John ziet	zien	ziet	1	5	plural	De groepen doktoren op John zien de persoon.
De hoeveelheden jongens op Mike bekritiseren	De hoeveelheden jongens op Mike bekritiseert	bekritiseren	bekritiseert	1	5	plural	De hoeveelheden jongens op Mike bekritiseren de persoon.
De paren zangers bij Jim herkennen	De paren zangers bij Jim herkent	herkennen	herkent	1	5	plural	De paren zangers bij Jim herkennen de persoon.
De aantallen leraren onder Bob vertrouwen	De aantallen leraren onder Bob vertrouwt	vertrouwen	vertrouwt	1	5	plural	De aantallen leraren onder Bob vertrouwen de persoon.
De stellen mannen naast John horen	De stellen mannen naast John hoort	horen	hoort	1	5	plural	De stellen mannen naast John horen de persoon.
De aantallen zangers op John bekritiseren	De aantallen zangers op John bekritiseert	bekritiseren	bekritiseert	1	5	plural	De aantallen zangers op John bekritiseren de persoon.
De hoeveelheden leraren op Bob missen	De hoeveelheden leraren op Bob mist	missen	mist	1	5	plural	De hoeveelheden leraren op Bob missen de persoon.
De stellen boeren bij Sue herkennen	De stellen boeren bij Sue herkent	herkennen	herkent	1	5	plural	De stellen boeren bij Sue herkennen de persoon.
De aantallen advocaten bij Linda groeten	De aantallen advocaten bij Linda groet	groeten	groet	1	5	plural	De aantallen advocaten bij Linda groeten de persoon.
De hoeveelheden boeren onder John missen	De hoeveelheden boeren onder John mist	missen	mist	1	5	plural	De hoeveelheden boeren onder John missen de persoon.
De groepen moeders naast Linda begrijpen	De groepen moeders naast Linda begrijpt	begrijpen	begrijpt	1	5	plural	De groepen moeders naast Linda begrijpen de persoon.
De hoeveelheden leraren onder John onderzoeken	De hoeveelheden leraren onder John onderzoekt	onderzoeken	onderzoekt	1	5	plural	De hoeveelheden leraren onder John onderzoeken de persoon.
De aantallen vaders naast Mike herkennen	De aantallen vaders naast Mike herkent	herkennen	herkent	1	5	plural	De aantallen vaders naast Mike herkennen de persoon.
De paren boeren bij Bill begrijpen	De paren boeren bij Bill begrijpt	begrijpen	begrijpt	1	5	plural	De paren boeren bij Bill begrijpen de persoon.
De groepen timmermannen onder Bill herkennen	De groepen timmermannen onder Bill herkent	herkennen	herkent	1	5	plural	De groepen timmermannen onder Bill herkennen de persoon.
De aantallen dichters achter Bill groeten	De aantallen dichters achter Bill groet	groeten	groet	1	5	plural	De aantallen dichters achter Bill groeten de persoon.
De groepen ooms naast Jim herkennen	De groepen ooms naast Jim herkent	herkennen	herkent	1	5	plural	De groepen ooms naast Jim herkennen de persoon.
De aantallen jongens naast Mike stimuleren	De aantallen jongens naast Mike stimuleert	stimuleren	stimuleert	1	5	plural	De aantallen jongens naast Mike stimuleren de persoon.
De hoeveelheden dichters bij Pat vertrouwen	De hoeveelheden dichters bij Pat vertrouwt	vertrouwen	vertrouwt	1	5	plural	De hoeveelheden dichters bij Pat vertrouwen de persoon.
De groepen ooms achter Linda missen	De groepen ooms achter Linda mist	missen	mist	1	5	plural	De groepen ooms achter Linda missen de persoon.
De hoeveelheden vrouwen onder Linda bekritiseren	De hoeveelheden vrouwen onder Linda bekritiseert	bekritiseren	bekritiseert	1	5	plural	De hoeveelheden vrouwen onder Linda bekritiseren de persoon.
De aantallen zangers op Sue bekritiseren	De aantallen zangers op Sue bekritiseert	bekritiseren	bekritiseert	1	5	plural	De aantallen zangers op Sue bekritiseren de persoon.
De paren tantes bij Mary bekritiseren	De paren tantes bij Mary bekritiseert	bekritiseren	bekritiseert	1	5	plural	De paren tantes bij Mary bekritiseren de persoon.
De hoeveelheden moeders onder Mike zien	De hoeveelheden moeders onder Mike ziet	zien	ziet	1	5	plural	De hoeveelheden moeders onder Mike zien de persoon.
De stellen jongens naast Bill begrijpen	De stellen jongens naast Bill begrijpt	begrijpen	begrijpt	1	5	plural	De stellen jongens naast Bill begrijpen de persoon.
De groepen doktoren bij John vertrouwen	De groepen doktoren bij John vertrouwt	vertrouwen	vertrouwt	1	5	plural	De groepen doktoren bij John vertrouwen de persoon.
De paren mannen onder Bob zien	De paren mannen onder Bob ziet	zien	ziet	1	5	plural	De paren mannen onder Bob zien de persoon.
De paren tantes onder Pat zien	De paren tantes onder Pat ziet	zien	ziet	1	5	plural	De paren tantes onder Pat zien de persoon.
De paren jongens onder Jim onderzoeken	De paren jongens onder Jim onderzoekt	onderzoeken	onderzoekt	1	5	plural	De paren jongens onder Jim onderzoeken de persoon.
De aantallen advocaten op John onderzoeken	De aantallen advocaten op John onderzoekt	onderzoeken	onderzoekt	1	5	plural	De aantallen advocaten op John onderzoeken de persoon.
De groepen doktoren bij Bob missen	De groepen doktoren bij Bob mist	missen	mist	1	5	plural	De groepen doktoren bij Bob missen de persoon.
De groepen moeders onder Mike bekritiseren	De groepen moeders onder Mike bekritiseert	bekritiseren	bekritiseert	1	5	plural	De groepen moeders onder Mike bekritiseren de persoon.
De hoeveelheden vaders achter Mike missen	De hoeveelheden vaders achter Mike mist	missen	mist	1	5	plural	De hoeveelheden vaders achter Mike missen de persoon.
De groepen mannen bij Mary groeten	De groepen mannen bij Mary groet	groeten	groet	1	5	plural	De groepen mannen bij Mary groeten de persoon.
De stellen doktoren achter Linda bekritiseren	De stellen doktoren achter Linda bekritiseert	bekritiseren	bekritiseert	1	5	plural	De stellen doktoren achter Linda bekritiseren de persoon.
De paren boeren bij Mary zien	De paren boeren bij Mary ziet	zien	ziet	1	5	plural	De paren boeren bij Mary zien de persoon.
De stellen vaders bij Bob zien	De stellen vaders bij Bob ziet	zien	ziet	1	5	plural	De stellen vaders bij Bob zien de persoon.
De aantallen jongens achter Barbara missen	De aantallen jongens achter Barbara mist	missen	mist	1	5	plural	De aantallen jongens achter Barbara missen de persoon.
De hoeveelheden dichters onder Linda missen	De hoeveelheden dichters onder Linda mist	missen	mist	1	5	plural	De hoeveelheden dichters onder Linda missen de persoon.
De aantallen vrienden op Barbara missen	De aantallen vrienden op Barbara mist	missen	mist	1	5	plural	De aantallen vrienden op Barbara missen de persoon.
De groepen mannen onder Pat bekritiseren	De groepen mannen onder Pat bekritiseert	bekritiseren	bekritiseert	1	5	plural	De groepen mannen onder Pat bekritiseren de persoon.
De hoeveelheden vrouwen op Barbara horen	De hoeveelheden vrouwen op Barbara hoort	horen	hoort	1	5	plural	De hoeveelheden vrouwen op Barbara horen de persoon.
De groepen meiden achter Pat onderzoeken	De groepen meiden achter Pat onderzoekt	onderzoeken	onderzoekt	1	5	plural	De groepen meiden achter Pat onderzoeken de persoon.
De hoeveelheden moeders naast Bob begrijpen	De hoeveelheden moeders naast Bob begrijpt	begrijpen	begrijpt	1	5	plural	De hoeveelheden moeders naast Bob begrijpen de persoon.
De hoeveelheden jongens onder Bob bekritiseren	De hoeveelheden jongens onder Bob bekritiseert	bekritiseren	bekritiseert	1	5	plural	De hoeveelheden jongens onder Bob bekritiseren de persoon.
De stellen advocaten op Pat herkennen	De stellen advocaten op Pat herkent	herkennen	herkent	1	5	plural	De stellen advocaten op Pat herkennen de persoon.
De aantallen advocaten op Jim zien	De aantallen advocaten op Jim ziet	zien	ziet	1	5	plural	De aantallen advocaten op Jim zien de persoon.
De aantallen mannen onder Mary zien	De aantallen mannen onder Mary ziet	zien	ziet	1	5	plural	De aantallen mannen onder Mary zien de persoon.
De paren jongens achter John groeten	De paren jongens achter John groet	groeten	groet	1	5	plural	De paren jongens achter John groeten de persoon.
De aantallen tantes achter John begrijpen	De aantallen tantes achter John begrijpt	begrijpen	begrijpt	1	5	plural	De aantallen tantes achter John begrijpen de persoon.
De aantallen tantes naast Bob zien	De aantallen tantes naast Bob ziet	zien	ziet	1	5	plural	De aantallen tantes naast Bob zien de persoon.
De groepen meiden op Barbara horen	De groepen meiden op Barbara hoort	horen	hoort	1	5	plural	De groepen meiden op Barbara horen de persoon.
De groepen dichters bij Mary bekritiseren	De groepen dichters bij Mary bekritiseert	bekritiseren	bekritiseert	1	5	plural	De groepen dichters bij Mary bekritiseren de persoon.
De paren vaders op Mary zien	De paren vaders op Mary ziet	zien	ziet	1	5	plural	De paren vaders op Mary zien de persoon.
De aantallen boeren bij Bill herkennen	De aantallen boeren bij Bill herkent	herkennen	herkent	1	5	plural	De aantallen boeren bij Bill herkennen de persoon.
De stellen timmermannen naast Mary herkennen	De stellen timmermannen naast Mary herkent	herkennen	herkent	1	5	plural	De stellen timmermannen naast Mary herkennen de persoon.
De groepen timmermannen achter John herkennen	De groepen timmermannen achter John herkent	herkennen	herkent	1	5	plural	De groepen timmermannen achter John herkennen de persoon.
De groepen dichters bij Pat begrijpen	De groepen dichters bij Pat begrijpt	begrijpen	begrijpt	1	5	plural	De groepen dichters bij Pat begrijpen de persoon.
De aantallen mannen naast Mike vertrouwen	De aantallen mannen naast Mike vertrouwt	vertrouwen	vertrouwt	1	5	plural	De aantallen mannen naast Mike vertrouwen de persoon.
De paren timmermannen onder Mary bekritiseren	De paren timmermannen onder Mary bekritiseert	bekritiseren	bekritiseert	1	5	plural	De paren timmermannen onder Mary bekritiseren de persoon.
De stellen vrouwen onder Jim missen	De stellen vrouwen onder Jim mist	missen	mist	1	5	plural	De stellen vrouwen onder Jim missen de persoon.
De stellen advocaten bij Bill onderzoeken	De stellen advocaten bij Bill onderzoekt	onderzoeken	onderzoekt	1	5	plural	De stellen advocaten bij Bill onderzoeken de persoon.
De groepen ooms achter Mike horen	De groepen ooms achter Mike hoort	horen	hoort	1	5	plural	De groepen ooms achter Mike horen de persoon.
De paren doktoren achter Pat begrijpen	De paren doktoren achter Pat begrijpt	begrijpen	begrijpt	1	5	plural	De paren doktoren achter Pat begrijpen de persoon.
De hoeveelheden tantes achter Bill herkennen	De hoeveelheden tantes achter Bill herkent	herkennen	herkent	1	5	plural	De hoeveelheden tantes achter Bill herkennen de persoon.
De groepen timmermannen achter Linda stimuleren	De groepen timmermannen achter Linda stimuleert	stimuleren	stimuleert	1	5	plural	De groepen timmermannen achter Linda stimuleren de persoon.
De groepen dichters op Pat begrijpen	De groepen dichters op Pat begrijpt	begrijpen	begrijpt	1	5	plural	De groepen dichters op Pat begrijpen de persoon.
De paren mannen onder Barbara horen	De paren mannen onder Barbara hoort	horen	hoort	1	5	plural	De paren mannen onder Barbara horen de persoon.
De groepen leraren achter Linda missen	De groepen leraren achter Linda mist	missen	mist	1	5	plural	De groepen leraren achter Linda missen de persoon.
De paren doktoren op Pat horen	De paren doktoren op Pat hoort	horen	hoort	1	5	plural	De paren doktoren op Pat horen de persoon.
De aantallen dichters op Sue bekritiseren	De aantallen dichters op Sue bekritiseert	bekritiseren	bekritiseert	1	5	plural	De aantallen dichters op Sue bekritiseren de persoon.
De hoeveelheden vrouwen onder Pat vertrouwen	De hoeveelheden vrouwen onder Pat vertrouwt	vertrouwen	vertrouwt	1	5	plural	De hoeveelheden vrouwen onder Pat vertrouwen de persoon.
De stellen vrienden op Jim onderzoeken	De stellen vrienden op Jim onderzoekt	onderzoeken	onderzoekt	1	5	plural	De stellen vrienden op Jim onderzoeken de persoon.
